[
  {
    "id": "office:president",
    "title": "President",
    "level": "FEDERAL",
    "officeType": "ELECTED_EXECUTIVE",
    "areaTypeScope": "COUNTRY",
    "electionTypeId": "election-type:presidential",
    "isElective": true,
    "isAppointed": false,
    "sources": [
      {
        "sourceId": "source:constitution:1999-as-amended",
        "confidence": "HIGH"
      }
    ],
    "quality": {
      "status": "SOURCE_MATCHED",
      "verificationLevel": "SOURCE_MATCHED",
      "lastVerifiedAt": null,
      "issues": []
    },
    "metadata": {}
  },
  {
    "id": "office:vice-president",
    "title": "Vice President",
    "level": "FEDERAL",
    "officeType": "ELECTED_EXECUTIVE",
    "areaTypeScope": "COUNTRY",
    "electionTypeId": "election-type:presidential",
    "isElective": true,
    "isAppointed": false,
    "sources": [
      {
        "sourceId": "source:constitution:1999-as-amended",
        "confidence": "HIGH"
      }
    ],
    "quality": {
      "status": "SOURCE_MATCHED",
      "verificationLevel": "SOURCE_MATCHED",
      "lastVerifiedAt": null,
      "issues": []
    },
    "metadata": {}
  },
  {
    "id": "office:senator",
    "title": "Senator",
    "level": "FEDERAL",
    "officeType": "ELECTED_LEGISLATIVE",
    "areaTypeScope": "SENATORIAL_DISTRICT",
    "electionTypeId": "election-type:senatorial",
    "isElective": true,
    "isAppointed": false,
    "sources": [
      {
        "sourceId": "source:constitution:1999-as-amended",
        "confidence": "HIGH"
      }
    ],
    "quality": {
      "status": "SOURCE_MATCHED",
      "verificationLevel": "SOURCE_MATCHED",
      "lastVerifiedAt": null,
      "issues": []
    },
    "metadata": {}
  },
  {
    "id": "office:house-of-reps-member",
    "title": "House of Representatives Member",
    "level": "FEDERAL",
    "officeType": "ELECTED_LEGISLATIVE",
    "areaTypeScope": "FEDERAL_CONSTITUENCY",
    "electionTypeId": "election-type:house-of-representatives",
    "isElective": true,
    "isAppointed": false,
    "sources": [
      {
        "sourceId": "source:constitution:1999-as-amended",
        "confidence": "HIGH"
      }
    ],
    "quality": {
      "status": "SOURCE_MATCHED",
      "verificationLevel": "SOURCE_MATCHED",
      "lastVerifiedAt": null,
      "issues": []
    },
    "metadata": {}
  },
  {
    "id": "office:governor",
    "title": "Governor",
    "level": "STATE",
    "officeType": "ELECTED_EXECUTIVE",
    "areaTypeScope": "STATE",
    "electionTypeId": "election-type:governorship",
    "isElective": true,
    "isAppointed": false,
    "sources": [
      {
        "sourceId": "source:constitution:1999-as-amended",
        "confidence": "HIGH"
      }
    ],
    "quality": {
      "status": "SOURCE_MATCHED",
      "verificationLevel": "SOURCE_MATCHED",
      "lastVerifiedAt": null,
      "issues": []
    },
    "metadata": {}
  },
  {
    "id": "office:deputy-governor",
    "title": "Deputy Governor",
    "level": "STATE",
    "officeType": "ELECTED_EXECUTIVE",
    "areaTypeScope": "STATE",
    "electionTypeId": "election-type:governorship",
    "isElective": true,
    "isAppointed": false,
    "sources": [
      {
        "sourceId": "source:constitution:1999-as-amended",
        "confidence": "HIGH"
      }
    ],
    "quality": {
      "status": "SOURCE_MATCHED",
      "verificationLevel": "SOURCE_MATCHED",
      "lastVerifiedAt": null,
      "issues": []
    },
    "metadata": {}
  },
  {
    "id": "office:state-house-of-assembly-member",
    "title": "State House of Assembly Member",
    "level": "STATE",
    "officeType": "ELECTED_LEGISLATIVE",
    "areaTypeScope": "STATE_CONSTITUENCY",
    "electionTypeId": "election-type:state-house-of-assembly",
    "isElective": true,
    "isAppointed": false,
    "sources": [
      {
        "sourceId": "source:constitution:1999-as-amended",
        "confidence": "HIGH"
      }
    ],
    "quality": {
      "status": "SOURCE_MATCHED",
      "verificationLevel": "SOURCE_MATCHED",
      "lastVerifiedAt": null,
      "issues": []
    },
    "metadata": {}
  },
  {
    "id": "office:lga-chairman",
    "title": "LGA Chairman",
    "level": "LOCAL",
    "officeType": "ELECTED_EXECUTIVE",
    "areaTypeScope": "LGA",
    "electionTypeId": "election-type:lga-chairman",
    "isElective": true,
    "isAppointed": false,
    "sources": [
      {
        "sourceId": "source:constitution:1999-as-amended",
        "confidence": "HIGH"
      }
    ],
    "quality": {
      "status": "SOURCE_MATCHED",
      "verificationLevel": "SOURCE_MATCHED",
      "lastVerifiedAt": null,
      "issues": []
    },
    "metadata": {}
  },
  {
    "id": "office:vice-chairman",
    "title": "Vice Chairman",
    "level": "LOCAL",
    "officeType": "ELECTED_EXECUTIVE",
    "areaTypeScope": "LGA",
    "electionTypeId": "election-type:lga-chairman",
    "isElective": true,
    "isAppointed": false,
    "sources": [
      {
        "sourceId": "source:constitution:1999-as-amended",
        "confidence": "HIGH"
      }
    ],
    "quality": {
      "status": "SOURCE_MATCHED",
      "verificationLevel": "SOURCE_MATCHED",
      "lastVerifiedAt": null,
      "issues": []
    },
    "metadata": {}
  },
  {
    "id": "office:councillor",
    "title": "Councillor",
    "level": "LOCAL",
    "officeType": "ELECTED_LEGISLATIVE",
    "areaTypeScope": "WARD",
    "electionTypeId": "election-type:lga-councillor",
    "isElective": true,
    "isAppointed": false,
    "sources": [
      {
        "sourceId": "source:constitution:1999-as-amended",
        "confidence": "HIGH"
      }
    ],
    "quality": {
      "status": "SOURCE_MATCHED",
      "verificationLevel": "SOURCE_MATCHED",
      "lastVerifiedAt": null,
      "issues": []
    },
    "metadata": {}
  },
  {
    "id": "office:fct-area-council-chairman",
    "title": "FCT Area Council Chairman",
    "level": "LOCAL",
    "officeType": "ELECTED_EXECUTIVE",
    "areaTypeScope": "AREA_COUNCIL",
    "electionTypeId": "election-type:fct-area-council-chairman",
    "isElective": true,
    "isAppointed": false,
    "sources": [
      {
        "sourceId": "source:constitution:1999-as-amended",
        "confidence": "HIGH"
      }
    ],
    "quality": {
      "status": "SOURCE_MATCHED",
      "verificationLevel": "SOURCE_MATCHED",
      "lastVerifiedAt": null,
      "issues": []
    },
    "metadata": {}
  },
  {
    "id": "office:fct-area-council-councillor",
    "title": "FCT Area Council Councillor",
    "level": "LOCAL",
    "officeType": "ELECTED_LEGISLATIVE",
    "areaTypeScope": "WARD",
    "electionTypeId": "election-type:fct-area-council-councillor",
    "isElective": true,
    "isAppointed": false,
    "sources": [
      {
        "sourceId": "source:constitution:1999-as-amended",
        "confidence": "HIGH"
      }
    ],
    "quality": {
      "status": "SOURCE_MATCHED",
      "verificationLevel": "SOURCE_MATCHED",
      "lastVerifiedAt": null,
      "issues": []
    },
    "metadata": {}
  },
  {
    "id": "office:minister",
    "title": "Minister",
    "level": "FEDERAL",
    "officeType": "APPOINTED_EXECUTIVE",
    "areaTypeScope": "COUNTRY",
    "electionTypeId": null,
    "isElective": false,
    "isAppointed": true,
    "sources": [
      {
        "sourceId": "source:constitution:1999-as-amended",
        "confidence": "HIGH"
      }
    ],
    "quality": {
      "status": "SOURCE_MATCHED",
      "verificationLevel": "SOURCE_MATCHED",
      "lastVerifiedAt": null,
      "issues": []
    },
    "metadata": {}
  },
  {
    "id": "office:minister-of-state",
    "title": "Minister of State",
    "level": "FEDERAL",
    "officeType": "APPOINTED_EXECUTIVE",
    "areaTypeScope": "COUNTRY",
    "electionTypeId": null,
    "isElective": false,
    "isAppointed": true,
    "sources": [
      {
        "sourceId": "source:constitution:1999-as-amended",
        "confidence": "HIGH"
      }
    ],
    "quality": {
      "status": "SOURCE_MATCHED",
      "verificationLevel": "SOURCE_MATCHED",
      "lastVerifiedAt": null,
      "issues": []
    },
    "metadata": {}
  },
  {
    "id": "office:secretary-to-government-of-federation",
    "title": "Secretary to the Government of the Federation",
    "level": "FEDERAL",
    "officeType": "APPOINTED_EXECUTIVE",
    "areaTypeScope": "COUNTRY",
    "electionTypeId": null,
    "isElective": false,
    "isAppointed": true,
    "sources": [
      {
        "sourceId": "source:constitution:1999-as-amended",
        "confidence": "HIGH"
      }
    ],
    "quality": {
      "status": "SOURCE_MATCHED",
      "verificationLevel": "SOURCE_MATCHED",
      "lastVerifiedAt": null,
      "issues": []
    },
    "metadata": {}
  },
  {
    "id": "office:head-of-federal-agency",
    "title": "Head of Federal Agency",
    "level": "FEDERAL",
    "officeType": "APPOINTED_EXECUTIVE",
    "areaTypeScope": "COUNTRY",
    "electionTypeId": null,
    "isElective": false,
    "isAppointed": true,
    "sources": [
      {
        "sourceId": "source:constitution:1999-as-amended",
        "confidence": "HIGH"
      }
    ],
    "quality": {
      "status": "SOURCE_MATCHED",
      "verificationLevel": "SOURCE_MATCHED",
      "lastVerifiedAt": null,
      "issues": []
    },
    "metadata": {}
  },
  {
    "id": "office:special-adviser",
    "title": "Special Adviser",
    "level": "ADMINISTRATIVE",
    "officeType": "APPOINTED_EXECUTIVE",
    "areaTypeScope": "COUNTRY",
    "electionTypeId": null,
    "isElective": false,
    "isAppointed": true,
    "sources": [
      {
        "sourceId": "source:constitution:1999-as-amended",
        "confidence": "HIGH"
      }
    ],
    "quality": {
      "status": "SOURCE_MATCHED",
      "verificationLevel": "SOURCE_MATCHED",
      "lastVerifiedAt": null,
      "issues": []
    },
    "metadata": {}
  },
  {
    "id": "office:senior-special-assistant",
    "title": "Senior Special Assistant",
    "level": "ADMINISTRATIVE",
    "officeType": "APPOINTED_EXECUTIVE",
    "areaTypeScope": "COUNTRY",